{
  "$schema": "https://json-schema.org/draft/2020-12/schema",
  "$id": "https://example.invalid/m01/feature-contract.schema.json",
  "title": "M01 Feature Contract",
  "type": "object",
  "additionalProperties": false,
  "required": [
    "schema_version",
    "feature_id",
    "outcome",
    "non_goals",
    "requirements",
    "tasks",
    "gates"
  ],
  "properties": {
    "schema_version": { "const": "1.0" },
    "feature_id": { "type": "string", "pattern": "^[A-Z0-9]+-[0-9]{3}$" },
    "outcome": { "type": "string", "minLength": 1 },
    "non_goals": {
      "type": "array",
      "minItems": 1,
      "items": { "type": "string", "minLength": 1 }
    },
    "requirements": {
      "type": "array",
      "minItems": 1,
      "items": {
        "type": "object",
        "additionalProperties": false,
        "required": ["id", "statement", "verification", "examples", "counterexamples"],
        "properties": {
          "id": { "type": "string", "pattern": "^R[FN]-[0-9]{3}$" },
          "statement": { "type": "string", "minLength": 1 },
          "verification": { "type": "string", "minLength": 1 },
          "examples": { "type": "array", "minItems": 1, "items": { "type": "string" } },
          "counterexamples": { "type": "array", "minItems": 1, "items": { "type": "string" } }
        }
      }
    },
    "tasks": {
      "type": "array",
      "minItems": 1,
      "items": {
        "type": "object",
        "additionalProperties": false,
        "required": ["id", "requirement_ids", "read_set", "write_set", "argv"],
        "properties": {
          "id": { "type": "string", "pattern": "^T-[0-9]{3}$" },
          "requirement_ids": { "type": "array", "items": { "type": "string" } },
          "read_set": { "type": "array", "items": { "type": "string" } },
          "write_set": { "type": "array", "items": { "type": "string" } },
          "argv": { "type": "array", "minItems": 1, "items": { "type": "string", "minLength": 1 } }
        }
      }
    },
    "gates": {
      "type": "array",
      "minItems": 1,
      "items": { "type": "array", "minItems": 1, "items": { "type": "string", "minLength": 1 } }
    }
  }
}

